id,title,description,authors,image,publisher,published_at,categories
159583,Harvesting Excellence,"Alain Ducasse is bewitched by America. The celebrated French chef has discovered, throughout the country, an excellence in food products that has inspired and reshaped his vision of Haute Cuisine. Whether it be in the cold Atlantic waters off the northern coast of Maine or the crimson-colored Arizona mountains, Alain Ducasse has found fishermen, ranchers and farmers across the nation whose products rank among the world's finest foods. Harvesting Excellence celebrates the men and women who devote themselves to the artistry of creating first-rate food products. They whip the thickest creams, shuck the plumpest oysters and feed the strongest game to ensure that only superior products are put on the market. Their stories, although based in a common passion for food, reflect the extraordinary breadth of America -- its climates, landscapes and, above all, its people. Through the book's beautifully illustrated, thematically organized chapters, Ducasse focuses on a select few producers who, with family methods and training from all over the world, yield products unique to American sun and soil. Here is the ultimate gourmet tour of what lies at the heart of all great cooking -- great ingredients. And as a final touch, top chefs from New York, Las Vegas and San Francisco give tips on selecting and preparing the best products for traditional or creative cooking.",Alain Ducasse,http://books.google.com/books/content?id=Z8UCAAAACAAJ&printsec=frontcover&img=1&zoom=1&source=gbs_api,Editions Assouline,2000,Cooking
9213,Cherokee Chronicles: From 1st Contact To The Trail of Tears,"From the earliest moments of European contact, Native Americans have played a pivotal role in the Atlantic experience, yet they often have been relegated to the margins of the region's historical record. The Red Atlantic, Jace Weaver's sweeping and highly readable survey of history and literature, synthesizes scholarship to place indigenous people of the Americas at the center of our understanding of the Atlantic world. Weaver illuminates their willing and unwilling travels through the region, revealing how they changed the course of world history. Indigenous Americans, Weaver shows, crossed the Atlantic as royal dignitaries, diplomats, slaves, laborers, soldiers, performers, and tourists. And they carried resources and knowledge that shaped world civilization--from chocolate, tobacco, and potatoes to terrace farming and suspension bridges. Weaver makes clear that indigenous travelers were cosmopolitan agents of international change whose engagement with other societies gave them the tools to advocate for their own sovereignty even as it was challenged by colonialism.",Jace Weaver,http://books.google.com/books/content?id=08IBAwAAQBAJ&printsec=frontcover&img=1&zoom=1&edge=curl&source=gbs_api,UNC Press Books,2014-03-17,History
82039,Non Stop,"Curiosity was discouraged in the Greene tribe. Its members lived out their lives in cramped Quarters, hacking away at the encroaching ponics. As to where they were - that was forgotten. Roy Complain decides to find out. With the renegade priest Marapper, he moves into unmapped territory, where they make a series of discoveries which turn their universe upside-down ... Non-Stop is the classic SF novel of discovery and exploration; a brilliant evocation of a familiar setting seen through the eyes of a primitive.",Brian Wilson Aldiss,http://books.google.com/books/content?id=98KVQgAACAAJ&printsec=frontcover&img=1&zoom=1&source=gbs_api,Gollancz,2000,Discoveries in geography
199115,Irritable Bowel Syndrome,"A Comprehensive Overview of Irritable Bowel Syndrome: Clinical and Basic Science Aspects presents up-to-date knowledge in the field and provides a comprehensive summary of this area of study, including an overview on IBS, starting from its pathogenesis, including genetic, microbial and physiological background, through symptom recognition, diagnosis and IBS treatment, both non-pharmacological and pharmacological. Compiles the most recent and comprehensive findings in pharmacological targets Highlights the role of extrinsic and intrinsic factors involved in disease development Written by leading researchers in the field of Irritable Bowel Syndrome to address research challenges in the field Includes bonus information on symptom recognition and diagnosis",Jakub Fichna,http://books.google.com/books/content?id=A7zbDwAAQBAJ&printsec=frontcover&img=1&zoom=1&edge=curl&source=gbs_api,Academic Press,2020-07-15,Science
40184,Hunters of Gor (The Gor Series),"Panther girls take center stage on Counter Earth in the series that “draw[s] on a combination of philosophy, science-fiction, and erotica” (Vice). Former Earthman Tarl Cabot is now a powerful Tarnsman of the brutal and caste-bound planet of Gor, also known as Counter Earth. He embarks on an adventure in the dangerous and mysterious wilderness of Gor, pitting his warrior’s skills against those of treacherous outlaws, bandits, and fighters. Three different women are working to bring change to Tarl’s far-from-peaceful life on Gor: Talena, his onetime queen and first love; Elizabeth, his brave fighting partner; and the Amazonian Verna, chief of the fierce and wild panther women. As Tarl journeys through the wilderness, the fates of these three remarkable women will finally be decided. Rediscover this brilliantly imagined world where men are masters and women live to serve their every desire. Hunters of Gor is the 8th book in the Gorean Saga, but you may enjoy reading the series in any order.",John Norman,http://books.google.com/books/content?id=_OIoAwAAQBAJ&printsec=frontcover&img=1&zoom=1&edge=curl&source=gbs_api,Open Road Media,2014-04-01,Fiction
133445,The Mirror of Merlin First Edition,"""Young sorcery fans . . . set aside Harry Potter and pick up Merlin! [""The Mirror of Merlin"" is] ingeniousIfilled with rich images [and] surprising touches of humor.U--""Cincinnati Enquirer. TRich with magic.""--""The New York Times Book Review.""",T. A. Barron,http://books.google.com/books/content?id=FwcW600zSW4C&printsec=frontcover&img=1&zoom=1&edge=curl&source=gbs_api,Penguin,2001,Juvenile Fiction
110648,The Art of the Game,"The key word here is art: the dynamic 3D art that defines the world of computer games. This book teaches you everything you need to know about the planning, modeling, texturing, lighting, effects creation, and interface design that go into creating today's most advanced and stunning video games. You'll be learning from a master-veteran 3D artist and instructor Matthew Omernick-as you progress through the carefully chosen, software-agnostic tutorials that make up this beautiful, full-color volume. The end result will be skills you can apply to whatever 3D tool you choose and whatever wildly imaginative game you can think up. Through a unique combination of explanation, tutorials, and real world documentation-including discussions of the creative process entailed in some of today's most popular games augmented by screen captures and descriptions--you'll quickly come to understand the workflow, tools, and techniques required to be a successful game artist. In addition to learning the ropes of game art, you'll also find in depth tutorials and techniques that apply to all aspects of 3D graphics. Whether you are using Photoshop, 3ds max, Maya, or any other computer graphics software, you'll find a wealth of information that you can continue to come back to time and time again.",Matthew Omernick,http://books.google.com/books/content?id=27-4GmyMBGEC&printsec=frontcover&img=1&zoom=1&edge=curl&source=gbs_api,New Riders,2004-03-24,Computers
165468,Word Magic for Writers,"Shows you how to boost the success potential of your writing project, whether an article, speech, story, book, play, or advertising, by elevating and energizing - charging up - the language in which it is written.",Cindy Rogers,http://books.google.com/books/content?id=3WLqPQAACAAJ&printsec=frontcover&img=1&zoom=1&source=gbs_api,Writer's Bookstore,2005-08-01,Language Arts & Disciplines
139274,An Illustrated History of the First World War,"Illustrates life on the home front, important battles, war from the perspective of generals and soldiers, the collapse of empires, and glimpses of World War II through photographs, paintings, cartoons, and posters.",John Keegan,http://books.google.com/books/content?id=zutpBgzSL4sC&printsec=frontcover&img=1&zoom=1&source=gbs_api,Knopf,2001,History
9980,The Civil War in Nicaragua: Inside the Sandinistas,"""The conflict in Nicaragua is one of the leastunderstood struggles of the Cold War. . . . This account clarifies the central issue and dispelsmany lingering myths."" --Zbigniew Breinski,National Security Advisor during the Carter administration","Roger Miranda', 'William E. Ratliff",http://books.google.com/books/content?id=4nFA9VByu3EC&printsec=frontcover&img=1&zoom=1&edge=curl&source=gbs_api,Transaction Publishers,1992-03-01,Political Science
123829,Clock of the Long Now: The Ideas Behind the World's Slowest Computer,"The author explores the dearth of ""long-term"" thinking in the Western world and proposes a plan to make future planning a regular feature of human consciousness.",Stewart Brand,http://books.google.com/books/content?id=6OYMAAAACAAJ&printsec=frontcover&img=1&zoom=1&source=gbs_api,Turtleback,1999-01-01,Philosophy
20138,The Prophet and the Astronomer,"""An intellectual accomplishment that illuminates the magic and the wisdom of the heavens above.""--Kirkus Reviews",Marcelo Gleiser,http://books.google.com/books/content?id=GUIpFrbSZt0C&printsec=frontcover&img=1&zoom=1&edge=curl&source=gbs_api,W. W. Norton & Company,2003,Science
179752,"Mobile Commerce : Opportunities, Applications, and Technologies of Wireless Business","This book provides the context, architectures, case studies, and intelligent analysis that will help you grasp this rapidly emerging subject. With keen insight into the needs of both camps, May explains the technological aspects of mobile commerce to business decision makers and the business models to the technologists who design and build these electronic systems. It is the one book all relevant p arties in a company can read to ensure common understanding. Topics include, devices, technologies, applications, standards, security, and more.",Paul May,http://books.google.com/books/content?id=DR46cekkqXgC&printsec=frontcover&img=1&zoom=1&edge=curl&source=gbs_api,Cambridge University Press,2001-04-19,Business & Economics
66531,A Journal of Poetic Thoughts,"A Poetry Journal to Poem Your Days Away! Don't wait for inspiration to strike! Whether you're an aspiring or published poet, this book will help you get in a frame of mind to make creative writing a consistent part of your life. With prompts from Robert Lee Brewer's popular Writer's Digest blog, Poetic Asides, you'll find 125 ideas for writing poems along with the journaling space you need to respond to the prompt. • 125 unexpected poetry prompts such as from the perspective of an insect, about a struggle, or including the word change • Plenty of blank space to compose your own poems • Tips on unique poetic forms and other poetry resources Perfectly sized to carry in a backpack or purse, you can jot down ideas for poems as you're waiting in line for a morning coffee or take it to the park for a breezy afternoon writing session. Wherever you are, your next poem is never more than a page-turn away.",Robert Lee Brewer,http://books.google.com/books/content?id=mvaKDwAAQBAJ&printsec=frontcover&img=1&zoom=1&edge=curl&source=gbs_api,Penguin,2019-03-19,Poetry
704,The Chosen (Night World),"All nine books in L.J. Smith’s beloved Night World series are now available in a special collector’s boxed set! Vampires, werewolves, witches, shapeshifters—they live among us without our knowledge. The Night World is their secret society, a society with very strict rules. And falling in love breaks them all. In Night World, Poppy has been diagnosed with terminal cancer. James, a vampire, can make Poppy immortal, but first they must risk everything to go against the laws of Night World. Three fugitive vampire sisters leave their isolated homes to live among humans in Daughters of Darkness. When their brother, Ash, is sent to bring the girls back, he falls in love with their beautiful friend. It’s a battle between black magic and white magic in Spellbinder as two witch cousins fight over their high school crush. In Dark Angel, Gillian is saved from drowning by her guardian angel who promises to fulfill her heart’s every desire. But when Angel starts making strange and sinister requests, Gillian must question who he truly is and where he came from. Armed with a wooden stake, martial arts, and the will to resist a vampire’s mind control, Rashel stuggles to avenge her mother’s death in The Chosen. Then she meets Quinn, her soulmate, who is part of the world she has vowed to destroy. Hannah receives notes warning her of incredible danger in Soulmate. But if death is her destiny, is the Lord of the Night World’s love strong enough to save her? A vampire hunter—who is half vampire herself—stalks other vampires to protect humans in Huntress. In Black Dawn, Maggie stumbles upon an old Night World kingdom where the ruling vampire prince is both an enemy and an ally. And in Witchlight, shapeshifter Keller must protect a rebellious teenager who may really be the legendary Witch Child, all while trying not to fall in love with the man destined to be the Witch Child’s soulmate.",L.J. Smith,http://books.google.com/books/content?id=NG5GvgAACAAJ&printsec=frontcover&img=1&zoom=1&source=gbs_api,Simon Pulse,2017-08-22,Young Adult Fiction
115997,Dead Secrets: Wilkie Collins and the Female Gothic,"Readers have long been enthralled by the novels of Wilkie Collins, whose The Moonstone is considered the first modern detective novel, This book by Tamar Heller places Collins within Victorian literary history, showing how his fiction transforms the conventions of the traditionally female genre of the Gothic novel and can be read as a critique of the gender and class distinctions that structured Victorian society.",Tamar Heller,http://books.google.com/books/content?id=QPmFzvxSdUMC&printsec=frontcover&img=1&zoom=1&source=gbs_api,Yale University Press,1992-01-01,Literary Criticism
36543,The Dynamic Laws of Prosperity : Forces That Bring Riches to You,"Imagine sitting in the lap of your favorite grandparent and learning the secrets to a magnificent, abundant life. Catherine Ponder writes in such a loving gentle way. The secrets she reveals are not secrets at all but universal truths for health, love, success and peace. As she explores these dynamic laws of prosperity she shares actual success stories to help those of us who are uncertain. There is no flowery prose here. Just plenty of practical advice for using Divine power to overcome difficulties and achieve happiness. Everyone can benefit from this book.",Catherine Ponder,http://books.google.com/books/content?id=U45HLQwoxsgC&printsec=frontcover&img=1&zoom=1&source=gbs_api,Devorss Publications,1985,Self-Help
108525,"Why Can't I Stop Eating: Recognizing, Understanding, and Overcoming Food Addiction","This straight-talking book puts the widespread problem of food addiction into clear perspective and points the way to a life free of the obsession with food. Why can't I stop eating? If, like millions of others, you often ask yourself this question, you may be addicted to food. The food you eat may be precisely what makes you crave more...and more. This straight-talking book puts the widespread problem of food addiction into clear perspective and points the way to a life free of the obsession with food. Debbie Danowski, whose food addiction nearly ruined her life, and Peter Lazaro combine forces to give readers a full understanding of this debilitating condition: its sources, patterns, consequences, and physiological underpinnings. Unlike fad diets and drugs with their side effects, hidden costs, and infamous failure rates, the program outlined in this book goes to the root cause of chronic overeating and puts the tools for a lifelong cure into the hands of anyone willing to accept responsibility for a healthy, happy future.","Debbie Danowski', 'Pedro Lazaro",http://books.google.com/books/content?id=WQLXDQAAQBAJ&printsec=frontcover&img=1&zoom=1&edge=curl&source=gbs_api,Simon and Schuster,2009-06-03,Self-Help
166820,Rainbow Road,"Jason Carrillo came out to his basketball team senior year and lost his university scholarship. Now, with graduation behind him and summer ending, he's asked to speak at the opening of a gay and lesbian high school across the country. But after spending years in the closet and losing his scholarship dream, what message can he offer? Kyle Meeks is getting ready to go to Princeton in the fall and trying to see as much as possible of his boyfriend Jason before they have to separate. When Jason tells him about his speaking invitation, Kyle jumps at the chance to drive across country with him. Yet he can't help worrying: Will their romance survive two weeks crammed together in a car? Nelson Glassman is happy his best friend Kyle has found love with Jason. Now he's looking for his own true love -- and hopes he might find his soul mate during the road trip. But will being the ""third wheel"" in a trio ruin his friendships with Kyle and Jason? During an eye-opening postgraduation summer road trip, each of the three very different boys also embarks on a personal journey across a landscape of love, sexuality, homophobia, and above all, friendship.",Alex Sanchez,http://books.google.com/books/content?id=vu4jhLARklgC&printsec=frontcover&img=1&zoom=1&edge=curl&source=gbs_api,Simon and Schuster,2010-05-11,Juvenile Fiction
164126,"Flapper: A Madcap Story of Sex, Style, Celebrity, and the Women Who Made America Modern","Flapper is a dazzling look at the women who heralded a radical change in American culture and launched the first truly modern decade. The New Woman of the 1920s puffed cigarettes, snuck gin, hiked her hemlines, danced the Charleston, and necked in roadsters. More important, she earned her own keep, controlled her own destiny, and secured liberties that modern women take for granted. Flapper is an inside look at the 1920s. With tales of Coco Chanel, the French orphan who redefined the feminine form; Lois Long, the woman who christened herself “Lipstick” and gave New Yorker readers a thrilling entrée into Manhattan’s extravagant Jazz Age nightlife; three of America’s first celebrities: Clara Bow, Colleen Moore, and Louise Brooks; Dallas-born fashion artist Gordon Conway; Zelda and Scott Fitzgerald, whose swift ascent and spectacular fall embodied the glamour and excess of the era; and more, this is the story of America’s first sexual revolution, its first merchants of cool, its first celebrities, and its most sparkling advertisement for the right to pursue happiness. Whisking us from the Alabama country club where Zelda Sayre first caught the eye of F. Scott Fitzgerald to Muncie, Indiana, where would-be flappers begged their mothers for silk stockings, to the Manhattan speakeasies where patrons partied till daybreak, historian Joshua Zeitz brings the 1920s to exhilarating life.",Joshua Zeitz,http://books.google.com/books/content?id=TIiL9OVQXhEC&printsec=frontcover&img=1&zoom=1&edge=curl&source=gbs_api,Crown,2009-02-04,History
79329,Principles of Physics,"This textbook presents a basic course in physics to teach mechanics, mechanical properties of matter, thermal properties of matter, elementary thermodynamics, electrodynamics, electricity, magnetism, light and optics and sound. It includes simple mathematical approaches to each physical principle, and all examples and exercises are selected carefully to reinforce each chapter. In addition, answers to all exercises are included that should ultimately help solidify the concepts in the minds of the students and increase their confidence in the subject. Many boxed features are used to separate the examples from the text and to highlight some important physical outcomes and rules. The appendices are chosen in such a way that all basic simple conversion factors, basic rules and formulas, basic rules of differentiation and integration can be viewed quickly, helping student to understand the elementary mathematical steps used for solving the examples and exercises. Instructors teaching form this textbook will be able to gain online access to the solutions manual which provides step-by-step solutions to all exercises contained in the book. The solutions manual also contains many tips, coloured illustrations, and explanations on how the solutions were derived.","Hafez A . Radi', 'John O Rasmussen",http://books.google.com/books/content?id=gJAmHavs8MEC&printsec=frontcover&img=1&zoom=1&edge=curl&source=gbs_api,Springer Science & Business Media,2012-11-02,Science
184122,The Sign of Jonah: A play in Nine Scenes,"Berlin. 1960. In America, Nixon loses to Kennedy, and Elvis Presley's ""It's Now Or Never"" tops the charts. In Hamburg, the Beatles record Gershwin's ""Summertime"" with Ringo and discover the Herbertstrasse. But in Berlin, Lutheran pastor Guenter Rutenborn struggles with the legacy of the Third Reich, and the significance of man's inhumanity to man. Who's to blame? Some say Hitler. Some say the German people. Some say God. Rutenborn writes a drama that puts God on trial. The angels and the Queen of Babylon are called as witnesses, and God is convicted. You will be, too.","Günter Rutenborn', 'George White",http://books.google.com/books/content?id=MV5kPAAACAAJ&printsec=frontcover&img=1&zoom=1&source=gbs_api,Dramatic Insights,2005,Drama
171648,Time to Choose,A story about a simple man who believes he is a Universal Soldier seeking Eternal Life through peace in the biological form—maybe God’s form. P. S.: All revenue created from this book of peace will be reinvested in this book of our peace. If you can’t afford a copy I will do my best to get you one. Thank You.,David G. Bickler,http://books.google.com/books/content?id=WuDZCwAAQBAJ&printsec=frontcover&img=1&zoom=1&edge=curl&source=gbs_api,Outskirts Press,2016-03-15,"Body, Mind & Spirit"
72399,"Autism Spectrum Disorders: The Complete Guide to Understanding Autism, Asperger's Syndrome, Pervasive Developmental Disorder, and Other ASDs","Explains all aspects of autism, including how to get an accurate diagnosis, coping strategies for families, and resources for educators and professionals.",Chantal Sicile-Kira,http://books.google.com/books/content?id=piLTCwAAQBAJ&printsec=frontcover&img=1&zoom=1&edge=curl&source=gbs_api,TarcherPerigee,2014,Family & Relationships
109316,Practical Statistics for Educators,"Practical Statistics for Educators, 4th edition focuses on the application of research and statistics as applied specifically to education. Since the first edition came out in 1994, thousand of students in educational statistics courses and their professors have found it to be an excellent textbook. Educational practitioners have also appreciated keeping this book on their reference shelf. Now in its fourth edition, this well-regarded text is a clear and easy-to-follow manual for use in introductory statistics or action research courses. Ruth Ravid concentrates on the essential concepts in educational statistics including when to use various statistical tests and how to interpret the results. Testing and test score interpretation, reliability, and validity are included to help students understand these topics which are essential for practitioners in education. Examples from the field of education are used throughout the book to illustrate the concepts, techniques, and interpretations that are presented in the book.","Ruth Ravid, professor emerita, National Louis University",http://books.google.com/books/content?id=ukpvhiixLc4C&printsec=frontcover&img=1&zoom=1&edge=curl&source=gbs_api,Rowman & Littlefield Publishers,2010-10-16,Education
106021,Night Lights: A Sukkot Story,A young boy learns about the meaning of Sukkot while overcoming his fear of the dark. Includes information on the history and customs of Sukkot.,Barbara Diamond Goldin,http://books.google.com/books/content?id=nFwrAQAAMAAJ&printsec=frontcover&img=1&zoom=1&source=gbs_api,Gulliver Books,1995,Juvenile Fiction
33236,San Francisco (Photopocket S.) (Multilingual Edition),"This seventh edition of THE POCKET CENGAGE HANDBOOK provides up-to-date, realistic advice for today's digital-age students. Instructors and students alike will find it clearly written, thorough, easy to navigate, and indispensable for use in college courses and beyond. As the authors of several composition handbooks, Kirszner and Mandell are consistently praised for their instinct for teaching, clarity, and student-friendliness, successfully bringing their student-centered approach to their discussion of writing. Each student text is packaged with a free Cengage Essential Reference Card to the MLA HANDBOOK, Eighth Edition. Important Notice: Media content referenced within the product description or the product text may not be available in the ebook version.","Laurie G. Kirszner', 'Stephen R. Mandell",http://books.google.com/books/content?id=xJZ4CgAAQBAJ&printsec=frontcover&img=1&zoom=1&edge=curl&source=gbs_api,Cengage Learning,2016-01-19,Language Arts & Disciplines
57752,Final War and Other Fantasies; Treasure of Tau Ceti,"Science Fiction and Fantasy Literature, A Checklist, 1700-1974, Volume one of Two, contains an Author Index, Title Index, Series Index, Awards Index, and the Ace and Belmont Doubles Index.","R. Reginald', 'Douglas Menville', 'Mary A. Burgess",http://books.google.com/books/content?id=P8zW2AH6150C&printsec=frontcover&img=1&zoom=1&edge=curl&source=gbs_api,Wildside Press LLC,2010-09,Reference
