id,title,description,authors,image,publisher,published_at,categories
142603,Buddhist Epistemology (Contributions in Philosophy),Provides a clear and exhaustive exposition of epistemology and logic in the Buddhist philosophical tradition.,"Siddheswar Rameshwar Bhatt', 'S. R.. Bhatt', 'Anu Mehrotra', 'Dignaga",http://books.google.com/books/content?id=G-cAoYoJSnYC&printsec=frontcover&img=1&zoom=1&edge=curl&source=gbs_api,Greenwood Publishing Group,2000,Religion
110478,Computational Chemistry Using the PC,"An introduction to computational chemistry, molecular orbital calculations and molecular mechanics. This second edition takes in recent developments in hardware and software. The book includes a disk with about 50 complete projects and selected output files suitable for self-study.",Donald Rogers,http://books.google.com/books/content?id=wAspAAAAYAAJ&printsec=frontcover&img=1&zoom=1&source=gbs_api,VCH Publishers,1994,Chemistry
190029,The Westerners: Frontier Stories,"A collection of seven western stories, one non-fiction piece on Death Valley, and one non-fiction story of whaling in Australia.",Zane Grey,http://books.google.com/books/content?id=7taJZVVs6CsC&printsec=frontcover&img=1&zoom=1&source=gbs_api,Five Star (ME),2000,Fiction
196329,"Pragmatics of human communication;: A study of interactional patterns, pathologies, and paradoxes","For the first time, a new generation of readers will have the opportunity to experience the ideas set forth in Pragmatics of Human Communication, a book that formed the foundation of much research into interpersonal communication in the latter portion of the 20th century. A new preface by Bill O'Hanlon puts Watzlawick's work in context for readers in this new paperback edition. Topics covered in this wide-ranging book include: the origins of communication; the idea that all behavior is communication; meta-communcation; the properties of an open system; the family as a system of communication; the nature of paradox in psychotherapy; existentialism and human communication. After defining certain general concepts, the authors present basic characteristics of human communication and illustrate their manifestations and potential pathologies. Then the systemic aspects of human interactions that arise from the patterning of specific characteristics of communication are exemplified by the analysis of Albee's Who's Afraid of Virginia Woolf?","Paul Watzlawick', 'Janet Beavin Bavelas', 'Don D. Jackson', ""Bill O",http://books.google.com/books/content?id=Ob9UAgAAQBAJ&printsec=frontcover&img=1&zoom=1&edge=curl&source=gbs_api,W. W. Norton & Company,2011-04-25,Psychology
155193,Discover Your Child's Learning Style: Children Learn in Unique Ways - Here's the Key to Every Child's Learning Success,"A guide to understanding learning strengths and weaknesses explains how to integrate talents, interests, disposition, and preferred learning environment into a successful, individualized educational plan","Mariaemma Willis', 'Victoria Kindle Hodson",http://books.google.com/books/content?id=5P70sRFbcY0C&printsec=frontcover&img=1&zoom=1&source=gbs_api,Prima Lifestyles,1999,Family & Relationships
121505,Diccionario espaol/ingls - ingls/espaol: Oxford Spanish,"Translation in Spanish-English and English-Spanish ; and this volume has 300,000 words and phrases; 500,000 translations.","Beatriz Galimberti Jarman', 'Roy Russell', 'Carol Styles Carvajal', 'Nicholas Rollin",http://books.google.com/books/content?id=Bdg5PwAACAAJ&printsec=frontcover&img=1&zoom=1&source=gbs_api,"Oxford University Press, USA",2008-01-01,Education
66467,Burt's Bees Baby Skin Care Kit (Mega Mini Kits),"With an instructional handbook on staying itch free, this kit features a safe herbal insect repellent and a soothing herbal ointment, along with a full-size tube of Burt's Bees Famous Beeswax Lip Balm. Illustrations. Consumable.",Running Press,http://books.google.com/books/content?id=7VVTAwAACAAJ&printsec=frontcover&img=1&zoom=1&source=gbs_api,Running PressBook Pub,2004-06,Health & Fitness
83429,"Eugenics and other evils,","From the introduction: ""I publish these essays at the present time for a particular reason connected with the present situation; a reason which I should like briefly to emphasise and make clear. Though most of the conclusions, especially towards the end, are conceived with reference to recent events, the actual bulk of preliminary notes about the science of Eugenics were written before the war ....""",Gilbert Keith Chesterton,http://books.google.com/books/content?id=m2xaAAAAMAAJ&printsec=frontcover&img=1&zoom=1&edge=curl&source=gbs_api,United Holdings Group,1922,Eugenics
44118,A History of the Church in England,History of the Church in England,John Moorman,http://books.google.com/books/content?id=6PwyEAAAQBAJ&printsec=frontcover&img=1&zoom=1&edge=curl&source=gbs_api,"Church Publishing, Inc.",1994,History
153273,The exquisite corpse;: A novel,"From the author of Lost Souls, Drawing Blood, and Wormwood comes a thrilling and chilling novel that bestselling author Peter Straub says serves as a “guidebook to hell.” To serial slayer Andrew Compton, murder is an art, the most intimate art. After feigning his own death to escape from prison, Compton makes his way to the United States with the sole ambition of bringing his “art” to new heights. Tortured by his own perverse desires, and drawn to possess and destroy young boys, Compton inadvertently joins forces with Jay Byrne, a dissolute playboy who has pushed his “art” to limits even Compton hadn’t previously imagined. Together, Compton and Byrne set their sights on an exquisite young Vietnamese-American runaway, Tran, whom they deem to be the perfect victim. Swiftly moving from the grimy streets of London’s Piccadilly Circus to the decadence of the New Orleans French Quarter, Poppy Z. Brite dissects the landscape of torture and invites us into the mind of a killer. Exquisite Corpse confirms Brite as a writer who defies categorization. It is a novel for those who dare trespass where the sacred and profane become one.",Poppy Z. Brite,http://books.google.com/books/content?id=sNjSPfnFNbUC&printsec=frontcover&img=1&zoom=1&edge=curl&source=gbs_api,Simon and Schuster,1997-08-20,Fiction
115523,Angel Oracle Deck: Let the Healing Energy of Angels into Your Life,"Angels have immense power to touch us with their protection, guidance, andlove. With this beautiful deck you now have the means to access this divine wisdom from the heavenly realm. You can pick a card to help you with an everyday problem, or you can make a selection to gain past, present and future perspectives on a major challenge. The 32-page booklet provides details on each of the 36 angels, and offers full instruction on how to best use the cards.",Ambika Wauters,http://books.google.com/books/content?id=THvDPAAACAAJ&printsec=frontcover&img=1&zoom=1&source=gbs_api,Connections Book Publishing,2006-02-15,"Body, Mind & Spirit"
17355,The Once-a-Week Cooking Plan: The Incredible Cooking Program That Will Save You 10 to 20 Hours a Week (and Have Your Family Begging for More!),At head of title: Hundreds of easy-to-make recipes.,Heather Houck Reseck,http://books.google.com/books/content?id=7b3EXJW6pfgC&printsec=frontcover&img=1&zoom=1&edge=curl&source=gbs_api,Review and Herald Pub Assoc,2002,Make-ahead cooking
102359,Devil Knows Youre Dead,"In the full-throttle, noir-soaked tradition of Dennis Lehane and Michael Connelly, the acclaimed young author of Bad Connection unleashes an ambitious and edgy new thriller pulsating with raw, urban energy. Decorated NYPD Officer John Coglin always thought his picture on the front page of the newspaper would be one for the scrapbook. That was before he had the bad luck to be forced into a witness-free, kill-or-be-killed confrontation with a drug-dealing thug. It's of no help to him that the incident took place during the run-up to a bitter mayoral election campaign, and that his adversary was sixteen years old and black. Now, instead of another commendation, Coglin is staring down the barrel of a media- and politics-stoked murder rap. But on the eve of his sure conviction arrives a fateful telephone call. It's not the governor, but his long-lost uncle, Aidan O'Connell. A veteran of the IRA and a recently released guest of San Quentin Penitentiary for armed-to-the-teeth robbery, Aidan offers his nephew a pardon that has nothing to do with lawyers. Coglin is about to find out that the type of amnesty Uncle Aidan is proposing is the kind that involves a beautiful but dangerous Mafia widow, a car trunk full of M-16s, and thirty million dollars in jewels smack dab in the middle of Rockefeller Center. Before the Devil Knows You're Dead is a highly entertaining, deliciously gritty, super-fast thriller that takes us on a cutthroat ride into an urban realm where criminal intent collides head-on with the vagaries of fate and the inscrutabilities of the human heart.",Michael Ledwidge,http://books.google.com/books/content?id=1IykHOGEVQ8C&printsec=frontcover&img=1&zoom=1&edge=curl&source=gbs_api,Simon and Schuster,2003-01-01,Fiction
120967,"Across Time, Love Eternal","Harry Porter type of adventure featuring a black youth and time travel through the ages, the pyramids of egypt and more",O. J. Harp,http://books.google.com/books/content?id=FuYEAAAACAAJ&printsec=frontcover&img=1&zoom=1&source=gbs_api,Seaburn Publishing,2002,Juvenile Fiction
137331,Piercing Time and Space,An Exploration of the understanding of nature and spirituality that links the scientific with the metaphysic.,Traci L. Slatton,http://books.google.com/books/content?id=sJPWAAAACAAJ&printsec=frontcover&img=1&zoom=1&source=gbs_api,Are Press,2005,"Body, Mind & Spirit"
134808,Tis: A Memoir,"Frank McCourt’s glorious childhood memoir, Angela’s Ashes, has been loved and celebrated by readers everywhere for its spirit, its wit and its profound humanity. A tale of redemption, in which storytelling itself is the source of salvation, it won the National Book Critics Circle Award, the Los Angeles Times Book Award and the Pulitzer Prize. Rarely has a book so swiftly found its place on the literary landscape. And now we have ’Tis, the story of Frank’s American journey from impoverished immigrant to brilliant teacher and raconteur. Frank lands in New York at age nineteen, in the company of a priest he meets on the boat. He gets a job at the Biltmore Hotel, where he immediately encounters the vivid hierarchies of this “classless country,” and then is drafted into the army and is sent to Germany to train dogs and type reports. It is Frank’s incomparable voice—his uncanny humor and his astonishing ear for dialogue—that renders these experiences spellbinding. When Frank returns to America in 1953, he works on the docks, always resisting what everyone tells him, that men and women who have dreamed and toiled for years to get to America should “stick to their own kind” once they arrive. Somehow, Frank knows that he should be getting an education, and though he left school at fourteen, he talks his way into New York University. There, he falls in love with the quintessential Yankee, long-legged and blonde, and tries to live his dream. But it is not until he starts to teach—and to write—that Frank finds his place in the world. The same vulnerable but invincible spirit that captured the hearts of readers in Angela’s Ashes comes of age. As Malcolm Jones said in his Newsweek review of Angela’s Ashes, “It is only the best storyteller who can so beguile his readers that he leaves them wanting more when he is done...and McCourt proves himself one of the very best.” Frank McCourt's ’Tis is one of the most eagerly awaited books of our time, and it is a masterpiece.",Frank McCourt,http://books.google.com/books/content?id=kI2EQAAACAAJ&printsec=frontcover&img=1&zoom=1&source=gbs_api,Scribner,2000-08-28,Biography & Autobiography
98505,A Pained Life: A Chronic Pain Journey,"In the blink of an eye, the most agonizing pain imaginable. And the authors life as she knew it was gone. The diagnosis was Trigeminal Neuralgia. And then, after months of spontaneous and constant pain - Chronic Pain. Ms. Levy takes us with her on her journey from who she was to who she became. We experience the fight with herself, the pain, and often the medical system itself, as she reaches out for relief and acceptance. ""A fascinating story, honestly told and courageously lived."" Stephen S. Hall, N.Y.Times magazine science and medicine writer. Author, Invisible Frontiers: The Race To Synthesize A Human Gene. ""This is the first time I have been let in so completely into the life of somewone living with chronic pain. A Pained Life is a compelling read. Ms. Levy has laid bare her experiencr so that others know that ultimately there is hope. I recommend it to pain patients, members of the medical community and the public at large."" John Park, M.D., anaesthesiologist and pain specialist. ""A Pained Life is an unsophisticated book, but it is so real, so honestly told, so suspenseful, that it is hard to put down. Carol Jay Levys courage and perseverance can help light the way for others who endure pain and a medical maze, with little hope and less help. Medical professionals might also gain insight from this personal story of someone at the other end of the stethoscope."" Kathy Lyons 3/28/04, American Chronic Pain Association. ""The detail with which the writer is able to describe the lead-up and surrounding details of the medical condition finally diagnosed as Trigeminal Neuralgia captures the readers attention with great intensity. The author has a good ability to draw emotions from the reader. She has done an exceptional job in writing so that the reader feels strong emotion about the author."" Writers Digest International Self-published Book Awards competition. ""My husband is reading your book now and seems *much* more empathetic. After he finishes it, I am lending it to my therapist and chiro who are great people but havent a clue what its like to live with pain 24/7. You are such a wonderful writer."" A.gye, pain patient. ""I finished the book, and it really was a GREAT read!! The way you described everything so vividly, made it feel like I was there along with you every step of the way! Jeremy Baker, Fox TV.",Carol Jay Levy,http://books.google.com/books/content?id=UoCfR9LyIAwC&printsec=frontcover&img=1&zoom=1&edge=curl&source=gbs_api,Xlibris Corporation,2003-09-12,Biography & Autobiography
75150,Remember Me to My Father,"In her award-winning book Harmful to Minors, Judith Levine radically upended our fixed ideas about childhood. Now, she tackles the other end of life in this poignant memoir of a daughter coming to terms with a difficult father who is sinking into dementia, presenting an insightful exploration of the ways we think about disability, aging, and the self as it resides in the body and the world. In prose that is unsentimental yet moving, serious yet darkly funny, complex in emotion and ideas yet spare in diction, Levine reassembles her father's personal and professional history even as he is losing track of it. She unpeels the layers of his complicated personality and uncovers information that surprises even her mother, to whom her father has been married for more than sixty years. As her father deteriorates, the family consensus about who he was and is and how best to care for him constantly threatens to collapse. Levine recounts the painful discussions, mad outbursts, and gingerly negotiations, and dissects the shifting alliances among family, friends, and a changing guard of hired caretakers. Spending more and more time with her father, she confronts a relationship that has long felt bereft of love. By caring for his needs, she learns to care about and, slowly, to love him. While Levine chronicles these developments, she looks outside her family for the sources of their perceptions and expectations, deftly weaving politics, science, history, and philosophy into their personal story. A memoir opens up to become a critique of our culture's attitudes toward the elderley. A claustrophobic account of Alzheimer's is transformed into a complex lesson about love, duty, and community. What creates a self and keeps it whole? Levine insists that only the collaboration of others can safeguard her father's self against the riddling of his brain. Embracing interdependence and vulnerability, not autonomy and productivity, as the seminal elements of our humanity, Levine challenges herself and her readers to find new meaning, even hope, in one man's mortality and our own.",Judith Levine,http://books.google.com/books/content?id=m7tcMh5IBjEC&printsec=frontcover&img=1&zoom=1&edge=curl&source=gbs_api,Simon and Schuster,2010-05-11,Biography & Autobiography
162163,Jazmin's Notebook,"Her name is Jazmin, and like the music of her name, her life throbs and swings?a few flat notes to be sure, but also bursting with rich passages that rise and soar. Sitting on her stoop she fills her notebook with laughs, anger, and hope. There?s the risky lure of ?luscious-looking? men and the consequences of free haircuts. This is a fourteen-year-old so-real girl living in Harlem in the 1960?s, ?born with clenched fists? and big dreams, and strengthened by the love of a steadfast sister. Captured within pages of her tough, exuberant life are all the beauty, chaos, confusion, and clarity that accompany the excitement of exploring life?s possibilities?and discovering they are endless.",Nikki Grimes,http://books.google.com/books/content?id=IytqDwAAQBAJ&printsec=frontcover&img=1&zoom=1&edge=curl&source=gbs_api,Penguin,2000-01-01,Juvenile Fiction
162413,Paul's Missionary Journeys Map,"Acts is the sequel to Luke's gospel and tells the story of Jesus's followers during the 30 years after his death. It describes how the 12 apostles, formerly Jesus's disciples, spread the message of Christianity throughout the Mediterranean against a background of persecution. With an introduction by P.D. James",P.D. James,http://books.google.com/books/content?id=i5DzFhBT3mIC&printsec=frontcover&img=1&zoom=1&edge=curl&source=gbs_api,Canongate Books,1999-01-01,Bibles
124555,Living Fossils (Casebooks in Earth Sciences),"The case history approach has an impressive record of success in a variety of disciplines. Collections of case histories, casebooks, are now widely used in all sorts of specialties other than in their familiar appli cation to law and medicine. The case method had its formal beginning at Harvard in 1871 when Christopher Lagdell developed it as a means of teaching. It was so successful in teaching law that it was soon adopted in medical education, and the collection of cases provided the raw material for research on various diseases. Subsequently, the case history approach spread to such varied fields as business, psychology, management, and economics, and there are over 100 books in print that use this approach. The idea for a series of Casehooks in Earth Science grew from my experience in organizing and editing a collection of examples of one variety of sedimentary deposits. The prqject began as an effort to bring some order to a large number of descriptions of these deposits that were so varied in presentation and terminology that even specialists found them difficult to compare and analyze. Thus, from the beginning, it was evident that something more than a simple collection of papers was needed. Accordingly, the nearly fifty contributors worked together with George de Vries Klein and me to establish a standard format for presenting the case histories.","N. Eldredge', 'S. M. Stanley",http://books.google.com/books/content?id=UPYxBwAAQBAJ&printsec=frontcover&img=1&zoom=1&edge=curl&source=gbs_api,Springer Science & Business Media,2012-12-06,Science
200602,Coherence in Thought and Action (Life and Mind: Philosophical Issues in Biology and Psychology),"This book is an essay on how people make sense of each other and the world they live in. Making sense is the activity of fitting something puzzling into a coherent pattern of mental representations that include concepts, beliefs, goals, and actions. Paul Thagard proposes a general theory of coherence as the satisfaction of multiple interacting constraints, and discusses the theory's numerous psychological and philosophical applications. Much of human cognition can be understood in terms of coherence as constraint satisfaction, and many of the central problems of philosophy can be given coherence-based solutions. Thagard shows how coherence can help to unify psychology and philosophy, particularly when addressing questions of epistemology, metaphysics, ethics, politics, and aesthetics. He also shows how coherence can integrate cognition and emotion.",Paul Thagard,http://books.google.com/books/content?id=Px0vctI8eGQC&printsec=frontcover&img=1&zoom=1&edge=curl&source=gbs_api,MIT Press,2002-07-26,Psychology
114840,Burning Daylight,"""Burning Daylight"" brings us back to the times of the Gold Rush. It tells the story of the most successful entrepreneur of Klondike, nicknamed ""Burning Daylight."" London based his novel on the life of Oakland entrepreneur ""Borax"" Smith. The protagonist makes big money in Alaska only to lose it to money kings as he returns home. Yet, his fate prepares him for many surprises: including an opportunity to win the money back and fall in love. ""Burning Daylight"" was one of the best-selling books of that year, and it was London's best-selling book in his lifetime.",Jack London,http://books.google.com/books/content?id=KgJ2EAAAQBAJ&printsec=frontcover&img=1&zoom=1&edge=curl&source=gbs_api,DigiCat,2022-06-13,Fiction
58951,Pictures of Personality : Guide to the Four Human Natures (TYPOLOGY),"The Picture of Personality reveals the first and only universal picture language of personality. The Guide deciphers the first and only standard set of definitions for human typology. The Guide shows how human nature mirrors Mother Nature. The push and pull of polar opposites creates our personality. Like day and night, we divide into a Light Side and a Dark Side that seek reunion. The conflict between our two sides creates the human journey--the search for the center.",John Lopker,http://books.google.com/books/content?id=XNsWTWJudFYC&printsec=frontcover&img=1&zoom=1&edge=curl&source=gbs_api,Personality Potter TYPOLOGY,2000,Typology (Psychology)
2354,The Secret of Wigglesworth's Power,"Discover the secrets of Smith Wigglesworths powerful relationship with God. One of the most admired ministers of the 20th century, Smith was known for the astounding miracles that happened in his meetings.",Albert Hibbert,http://books.google.com/books/content?id=Moqz-x9W_EUC&printsec=frontcover&img=1&zoom=1&edge=curl&source=gbs_api,Harrison House Publishers,2009-04-15,Religion
149571,Telecom Churn Management (Customer Telecare Series),"Telecom Churn Management, The Golden Opportunity explains how and why churn is managed today. It discusses the Tele-centric (Customer Centric Telecommunications) model for customer management. The book provides the key Analytics that can give your company the competitive advantage. The key first step is recombinant segmentation (identification). Using extended behavioral segmentation (categorization), carriers can produce a customer value function (valuation). Churn models and indexes can be used to determine the projected churn rates (Anticipation). Using key metrics and a WAR Gameboard, the profit levels for customers can be evaluated and maximized. Managers of successful telecom service providers need to understand why customers leaving and what makes telecom churn so special. Successful telecom managers have developed churn management strategies to help them making wise churn investment decisions that give them quick and effective churn response options. By understanding that customers have key telecom consumer shopping cycles and response models, churn management can be turned into an operational perspective. It is a well-known fact that telecommunication technology and services are continually changing. Industry veteran Rob Mattison shares his expertise typical interconnection arrangements for pubic and private telephone systems, data networks, inter-exchange systems, wireless, billing and customer care systems. If there were one book you could use to help understand and develop and telecom churn management programs, ""Telecom Churn Management"" is the best choice.",Rob Mattison,http://books.google.com/books/content?id=iUcFAAAACAAJ&printsec=frontcover&img=1&zoom=1&source=gbs_api,Apdg Pub,2001,Technology & Engineering
16644,Think Like a Shrink: 100 Principles for Seeing Deeply into Yourself and Others,"A Companion for the Uncouched Based on a highly regarded article in Psychology Today that has been reprinted worldwide, Think Like a Shrink is a personality primer that refines years of psychiatric training into 100 principles. Here you will quickly learn to understand what motivates your boss, your spouse, your parents -- and yourself. Incorporating the most basic fundamentals that drive the human personality, these principles are short, clear, and simple, but not simplistic. They include enlightening observations and real eye-openers, such as: Some people never forgive a favor. In any marriage, there can only be one number one. Too much love may mean hate; too much hate may mean love. Successful neuroses help people fail. Electra and Oedipus keep psychiatrists in business.",Emmanuel Dr. Rosen,http://books.google.com/books/content?id=o1n1lIuFdbYC&printsec=frontcover&img=1&zoom=1&edge=curl&source=gbs_api,Simon and Schuster,2001-07-12,Psychology
