id,title,description,authors,image,publisher,published_at,categories
189915,The Children of the Cold,"To Save the Children of Korea is the first book about the origins and history of international adoption. Although it has become a commonplace practice in the United States, we know very little about how or why it began, or how or why it developed into the practice that we see today. Arissa Oh argues that international adoption began in the aftermath of the Korean War. First established as an emergency measure through which to evacuate mixed-race ""GI babies,"" it became a mechanism through which the Korean government exported its unwanted children: the poor, the disabled, or those lacking Korean fathers. Focusing on the legal, social, and political systems at work, this book shows how the growth of Korean adoption from the 1950s to the 1980s occurred within the context of the neocolonial U.S.-Korea relationship, and was facilitated by crucial congruencies in American and Korean racial thought, government policies, and nationalisms. It also argues that the international adoption industry played an important but unappreciated part in the so-called Korean ""economic miracle."" Korean adoption served as a kind of template as international adoption began, in the late 1960s, to expand to new sending and receiving countries. Ultimately, Oh demonstrates that although Korea was not the first place that Americans adopted from internationally, it was the place where organized, systematic international adoption was born.",Arissa H. Oh,http://books.google.com/books/content?id=0Hz8CAAAQBAJ&printsec=frontcover&img=1&zoom=1&edge=curl&source=gbs_api,Stanford University Press,2015-06-17,History
129143,"SWT: The Standard Widget Toolkit, Volume 1","Explains how to customize the Java integrated development environment, covering navigation, terminology, extension, the plug-in architecture, and frameworks.","Anjou"", 'Scott Fairbrother', 'Dan Kehn', 'John Kellerman', 'Pat McCarthy",http://books.google.com/books/content?id=6Ob1ANNVcXcC&printsec=frontcover&img=1&zoom=1&edge=curl&source=gbs_api,Addison-Wesley Professional,2005,Computers
8834,Air Force One: The Presidents and the Planes,"From the award-winning chief White House correspondent for U.S. News & World Report comes the definitive history of Air Force One. From FDR's prop-driven Pan Am to the glimmering blue and white jumbo 747 on which George W. Bush travels, the president's plane has captured the public's awe and imagination, and is recognized around the world as a symbol of American power. In this unique book, Kenneth Walsh looks at the decisions that our last 12 presidents made on the plane; the personality traits and peccadilloes they revealed when their guard was down; and the way they each established a distinctive mood aboard that was a reflection of their times, as well as their individual personalities. Based on interviews with four living presidents, scores of past and present White House officials, and staff and crew members of Air Force One, Walsh's book reveals countless fascinating stories of life aboard the ""flying White House."" It also features descriptions of the food, the decor, the bedrooms, the medical clinic, and much more -- as well as remarkable photos of the planes (inside and out) and the presidents.",Kenneth T. Walsh,http://books.google.com/books/content?id=aWTywAEACAAJ&printsec=frontcover&img=1&zoom=1&source=gbs_api,Hyperion,2003-05-14,History
117353,The Monument: Art and Vulgarity in Saddam Hussein's Iraq,"Explores the connection between art and totalitarianism, using Saddam Hussein's ""Victory Arch"" in Baghdad as a starting point for a discussion on how dictators use art to legitimize their regimes","Samir Khalil', 'Kanan Makiya', 'Samir Al-Khalil",http://books.google.com/books/content?id=tJFvsX2ZFjcC&printsec=frontcover&img=1&zoom=1&edge=curl&source=gbs_api,Univ of California Press,1991-01-01,Political Science
21949,Dubious Conceptions: The Politics of Teenage Pregnancy,Argues that the social and economic forces that discourage better-off women to delay childbirth are the same forces that push disadvantaged women to early pregnancy,Kristin Luker,http://books.google.com/books/content?id=Vayy1oxHPbAC&printsec=frontcover&img=1&zoom=1&edge=curl&source=gbs_api,Harvard University Press,1996,Health & Fitness
208931,"The Venus Hottentot (Callaloo Poetry Series, Number 9)","Four decades ago Tom F. Driver brought theater into discussion with religion and modern theology. It has been a rich ongoing dialogue, but one that now demands a bold new engagement. In Theater and Integrity, Larry D. Bouchard argues that while the “antitheatrical prejudice” regards theater as epitomizing the absence of integrity, theater’s ways of being realized in ensembles, texts, and performances allow us to reenvision integrity’s emergence and ephemeral presence. This book follows such questions across theatrical, philosophical, and theological studies of moral, personal, bodily, and kenotic patterns of integrity. It locates ambiguities in our discourse about integrity, and it delves into conceptions of identity, morality, selfhood, and otherness. Its explorations ask if integrity is less a quality we might possess than a contingent gift that may appear, disappear, and perhaps reappear. Not only does he chart anew the ethical and religious dimensions of integrity, but he also reads closely across the history of theater, from Greek and Shakespearean drama to the likes of Seamus Heaney, T. S. Eliot, Caryl Churchill, Wole Soyinka, Tony Kushner, and Suzan-Lori Parks. His is an approach of juxtaposition and reflection, starting from the perennial observation that theater both criticizes and acknowledges dimensions of drama and theatricality in life.",Larry D. Bouchard,http://books.google.com/books/content?id=Mbvi3uQX7WYC&printsec=frontcover&img=1&zoom=1&edge=curl&source=gbs_api,Northwestern University Press,2011,Drama
133826,An amateur's guide to the Messier objects,"Every amateur astronomer has at least heard of the many different catalogs of deep-sky objects; the most well known are the Messier, the Caldwell, the Herschel, and the NGC. All of these catalogs are, in general, readily available, but very few amateur observers are in a position to choose the best catalog for their particular deep-sky observing program, know how to use the catalog, or even realize just how many there are out there! The Amateur Astronomer's Guide to the Deep-sky Catalogs is a single compilation of the historical and modern astronomical deep-sky catalogs. It discusses their origins, compares what's in them, explains how to interpret the data they contain, and even outlines how readers can create suitable 'custom' catalogs for their own use. The last section provides a set of three deep-sky catalogs created by the author, for observers of different levels of experience, from newcomer to expert.",Jerry D. Cavin,http://books.google.com/books/content?id=RZwFnwEACAAJ&printsec=frontcover&img=1&zoom=1&source=gbs_api,Springer,2011-09-25,Science
147494,Deadly Combo,"A young man is found dead in the room of one of South Florida’s most exclusive hotels. Unable to determine a cause of death, police and forensic pathologists are baffled. Dr. Clifford Mandich, chief dermatology resident at Miami’s Jackson Memorial Hospital and cousin of the dead man, has a fascination for detective novels. He and his uncle, a detective in the Miami-Dade Police Department, are forced to investigate. Dr. Mandich’s knowledge of medicine and dermatology help him recognize clues that other investigators overlook. He becomes romantically involved with Lauren Jeffries, a beautiful woman and partner in an accounting firm. She becomes both a distraction and an ally in the search for a possible killer or killers. Elements of international smuggling, kidnapping, deceit, and romance come together in South Florida’s enticing climate.",Garry & Sheila Gewirtzman,http://books.google.com/books/content?id=oL3C381tqMwC&printsec=frontcover&img=1&zoom=1&edge=curl&source=gbs_api,PublishAmerica,2005-12-19,Fiction
111391,"The earth shook, the sky burned","Illustrated with more than four hundred on-the-scene photographs, this is the definitive account of the 1906 earthquake and fire that devastated San Francisco. The Earth Shook, The Sky Burned tells the tragic story of the four days of upheaval and destruction that swept San Francisco when a violent earth tremor rocked the land, succeeded rapidly by a devastating fire that destroyed nearly thirty thousand buildings and left more than a quarter million people homeless. William Bronson’s blow-by-blow account is full of dramatic detail and includes a fascinating cast of characters, including Enrico Caruso, John Barrymore, and other turn of the century icons. A classic of San Francisco history, The Earth Shook, The Sky Burned reveals what really happened that April morning when the face of the city was changed forever.",William Bronson,http://books.google.com/books/content?id=HeyKAwAAQBAJ&printsec=frontcover&img=1&zoom=1&edge=curl&source=gbs_api,Chronicle Books,2014-05-20,History
137441,Itzaj Maya-Spanish-English Dictionary / Diccionario maya itzaj-espaol-ingls,"Charles Andrew Hofling Smithsonian-Utah Publications in American Indian Languages Lyle Campbell and Ives Goddard Linguistics This is highly valuable dictionary of the Mopan (Mayan) language. In addition to its many entries, it also provides an introductory grammatical description, as well as general dictionary features such as parts of speech, examples, cross-references, variant forms, homophones, and indexes. The book also contains special sections on orthography and pronunciation unique to this important Mayan language, as well as translations into English and Spanish. The dictionary has the merits well known from other dictionaries of indigenous languages of the Americas, preserving knowledge systems as they are encoded in vocabulary and providing valuable information for numerous fields, including Mayanists, Mesoamericanists, American Indian scholars, anthropologists, historians, linguists, students of Mayan hieroglyphic writing, and members of modern Mayan communities, among others. This is the second book in the new Smithsonian-Utah Publications in American Indian Languages (SUPAIL) series, a joint venture of the University of Utah Press and the Smithsonian Institution.",Charles A Hofling,http://books.google.com/books/content?id=2vyRSQAACAAJ&printsec=frontcover&img=1&zoom=1&source=gbs_api,University of Utah Press,2011-04-29,Foreign Language Study
140509,Beasley's Guide to Library Research,"Beasley's Guide to Library Research offers straightforward help in navigating the complex labyrinth of library research. Suitable for novice and experienced researcher alike, this revised classic is an invaluable tool for locating and using materials from research libraries anywhere in the world. Written and organized for easy access, the reader is guided step-by-step through library rules and methods of operation, the effective use of microfilms and various cataloguing systems, and the location of materials using bibliographies, reference books, and periodical indices. Also covered are the most modern forms of research, including computer databases, inter-library loan systems, and online computer searches. Whether the reader is a student, teacher, writer, librarian or business person, Beasley's Guide to Library Research provides the essential information that enables all library users to make the most of their research time.",David Beasley,http://books.google.com/books/content?id=0zdEDAAAQBAJ&printsec=frontcover&img=1&zoom=1&edge=curl&source=gbs_api,University of Toronto Press,2000-12-15,Language Arts & Disciplines
146527,John Hus;: A biography,"In this biography the author extends our understanding of the personality and work of the man he has characterized as ""essentially a reformer whose ideal was the pure church."" Since 1915, the date of the last similar study of Hus, a great deal of new information has become available, especially in the Czech language. Professor Spinka has based his study on these new materials and on critical works about Hus. He has also abstracted Hus' writings, in Latin and in Czech, thereby clarifying what Hus taught. Originally published in 1968. The Princeton Legacy Library uses the latest print-on-demand technology to again make available previously out-of-print books from the distinguished backlist of Princeton University Press. These editions preserve the original texts of these important books while presenting them in durable paperback and hardcover editions. The goal of the Princeton Legacy Library is to vastly increase access to the rich scholarly heritage found in the thousands of books published by Princeton University Press since its founding in 1905.",Matthew Spinka,http://books.google.com/books/content?id=ZJMrDgAAQBAJ&printsec=frontcover&img=1&zoom=1&edge=curl&source=gbs_api,Princeton University Press,2017-03-14,Biography & Autobiography
58042,A History of Light,"This text traces the interplay of forces in the history of light from the 17th century to the 1990s. It provides portraits of many of the scientists whose achievements constituted that history, and of major inventors and artistic and literary figures who c.",Richard Jerome Weiss,http://books.google.com/books/content?id=6ThqDQAAQBAJ&printsec=frontcover&img=1&zoom=1&edge=curl&source=gbs_api,World Scientific,1996,Science
76728,Rosenhan: Abnormal Psychology 2ed (Cloth),"In this fully updated edition of Believing in Magic, renowned superstition expert Stuart Vyse investigates our tendency towards these irrational beliefs.",Stuart A. Vyse,http://books.google.com/books/content?id=fWMGAQAAQBAJ&printsec=frontcover&img=1&zoom=1&edge=curl&source=gbs_api,Oxford University Press,2013-11,Medical
4913,Death At The Crossroads,"Matsuyama Kaze is a ronin, or masterless samurai. Kaze must travel across Japan until he fulfills a promise made to his dying Lord and Lady -- to find their nine-year-old daughter.",Dale Furutani,http://books.google.com/books/content?id=vNhqqVoF96oC&printsec=frontcover&img=1&zoom=1&edge=curl&source=gbs_api,"Pioneer Drama Service, Inc.",1999,Japan
157446,Health Care Strategy for Uncertain Times,"An AHA Press/Jossey-Bass Publication Learn to reconceptualize strategy development in today's uncertain environment. This book introduces three specific techniques--scenario planning, decision analysis, and game theory-- that have been developed in the corporate world and tailored to the unique needs of the health care industry. The book also shares practical implementation approaches, presents numerous real life case studies and lessons learned, and provides guidelines for reducing financial risks during plan implementation.",Marian C. Jennings,http://books.google.com/books/content?id=KyJ8QgAACAAJ&printsec=frontcover&img=1&zoom=1&source=gbs_api,Jossey-Bass,2000-10-10,Health & Fitness
52135,To Die for Germany: Heroes in the Nazi Pantheon,"Baird (history, Miami U., Ohio) illuminates the political culture of the Third Reich by focusing on the regime's fascination with motifs of death. He traces the development of Nazi propaganda from the fields of Flanders in 1914 to the cult of death created by Hitler, Goebbels, and others during World War II. Annotation copyrighted by Book News, Inc., Portland, OR",Jay W. Baird,http://books.google.com/books/content?id=mZihrV9IAJMC&printsec=frontcover&img=1&zoom=1&edge=curl&source=gbs_api,Indiana University Press,1992,History
207701,"Midnight Murder (The Avenger, 24)","Science fiction constitutes one of the largest and most widely read genres in literature, and this reference provides bibliographical data on some 20,000 science fiction, fantasy, and horror fiction books, as well as nonfiction monographs about the literature. A companion to Reginald's Science Fiction and Fantasy Literature, 1700-1974 (Gale, 1979), the present volume is alphabetically arranged by approximately 10,000 author names. The entry for each individual work includes title, publisher, date and place published, number of pages, hardbound or paperback format, and type of book (novel, anthology, etc.). Where appropriate, entries also provide translation notes, series information, pseudonyms, and remarks on special features (such as celebrity introductions). Includes indexes of titles, series, awards, and ""doubles"" (for locating volumes containing two novels). Annotation copyright by Book News, Inc., Portland, OR.","R. Reginald', 'Mary Wickizer Burgess', 'Daryl Furumi Mallett",http://books.google.com/books/content?id=AdMSAQAAMAAJ&printsec=frontcover&img=1&zoom=1&source=gbs_api,Detroit : Gale Research,1992,Authors
114932,"Books and articles on South Carolina history;: A list for laymen (Tricentennial booklet, no. 8)","Louis Wright's masterful telling of South Carolina's story will fascinate residents and non-residents alike. A land whose people knew the joy of great victories and the sadness of bitter defeats, South Carolina gave us the first Americans cowboys, the cotton gin, and a long list of colorful military and political figures, from Swamp-Fox Marion to Pitchfork Ben Tillman and Cotton Ed Smith. Louis Wright's masterful telling of the story will fascinate residents and non-residents alike.",Louis B. Wright,http://books.google.com/books/content?id=9bzfAAAAQBAJ&printsec=frontcover&img=1&zoom=1&edge=curl&source=gbs_api,W. W. Norton & Company,1977-10-17,History
140168,Keene (NH) (Images of America),"Keene has a history as fascinating and diverse as it is long. It has changed a great deal in the last 140 years, growing from a small village in the 1850s to the industrial and commercial center of the ""Currier and Ives"" corner of New Hampshire by the 1960s. Yet while many tremendous and sometimes tumultuous changes have taken place in Keene, the proud spirit of its people and the rural beauty of the surrounding area have remained constant, proving that a balanced combination of history and change can be a recipe for success as the twentieth century draws to a close and we enter an almost unthinkably different twenty-first.",Alan F. Rumrill,http://books.google.com/books/content?id=OrnDkp0cPiQC&printsec=frontcover&img=1&zoom=1&edge=curl&source=gbs_api,Arcadia Publishing,1995-07-01,History
68217,Beyond the Desert Gate,"Palestine, first century A.D.-the Jews have revolted against Roman occupation. The ten Greek cities of Palestine-the Decapolis-want only to continue their peaceful trading existence, but they find themselves caught in the middle of the uprisings. Apollodorus, a merchant of Philadelphia, takes a risk and rescues a man whom a Roman patrol has left to die in the desert. When Apollodorus is killed by robbers, his three sons are left almost penniless and must each find a way for themselves. Philo, the youngest, is befriended by Xenos, the man saved from the desert, who has lost his memory. From him the boy learns the art of the scribe, and together they try to find their identity-one from the past, the other for the future. A serious story of an important time in history. This is the sequel to The Ides of April.",Mary Ray,http://books.google.com/books/content?id=EZsIAQAAQBAJ&printsec=frontcover&img=1&zoom=1&edge=curl&source=gbs_api,Bethlehem Books,2001-01-01,Juvenile Fiction
164818,Fundamentals of Thermodynamics,"Now in its eighth edition, Fundamentals of Thermodynamics continues to offer a comprehensive and rigorous treatment of classical thermodynamics, while retaining an engineering perspective. With concise, applications-oriented discussion of topics and self-test problems, this text encourages students to monitor their own learning. The eighth edition is updated with additional examples and end-of-chapter problems to increase student comprehension. In addition, Learning Objectives have been added to the beginning of each chapter. This classic text provides a solid foundation for subsequent studies in fields such as fluid mechanics, heat transfer and statistical thermodynamics, and prepares students to effectively apply thermodynamics in the practice of engineering.","Claus Borgnakke', 'Richard E. Sonntag",http://books.google.com/books/content?id=3VcaygEACAAJ&printsec=frontcover&img=1&zoom=1&source=gbs_api,Wiley,2012-12-26,Science
136837,"The New York Times Toughest Crossword Puzzles, Volume 8 (NY Times)","The biggest, best collection of Sunday crosswords ever published!",The New York Times,http://books.google.com/books/content?id=09DtD5EP41AC&printsec=frontcover&img=1&zoom=1&edge=curl&source=gbs_api,Macmillan,2006-09-19,Games & Activities
103439,Gentle Julia,"A light and witty novel, 'Gentle Julia' is filled with characters who you can't help but smile at. With an old-fashioned feel to it, this Booth Tarkington classic follows the escapades of a Julia Atwater and her younger cousin Florence as suitors attempt to woo her across town. Set in Indiana in the early 20th century, the story is entwined with silliness and the old-fashioned. Newton Booth Tarkington was an American novelist and dramatist best known as a multiple Pulitzer Prize-winner. He is only one of a handful of novelists to winning the Pulitzer Price more than once, winning it with his novels 'The Magnificent Ambersons' and 'Alice Adams'. Many of Tarkington's college years at Princeton and adult life are said to have mirror F. Scott Fitzgerald's. His popularity has declined over the decades but at one stage in the 1910s and 1920s he was considered one of America's best authors.",Booth Tarkington,http://books.google.com/books/content?id=w0ljEAAAQBAJ&printsec=frontcover&img=1&zoom=1&edge=curl&source=gbs_api,Lindhardt og Ringhof,2022-03-22,Fiction
185677,Veinte Poemas de Amor y Una Cancion Desesperada: Cien Sonetos de Amor (Debolsillo) (Spanish Edition),"Una de las obras más célebres del poeta Pablo Neruda. « Me gusta cuando callas porque estás como ausente. Distante y dolorosa como si hubieras muerto. Una palabra entonces, una sonrisa bastan. Y estoy alegre, alegre de que no sea cierto .» Reseña: «Neruda significa un hombre nuevo en la América, una sensibilidad con la cual abre todo capítulo emocional americano. Su alta categoría arranca de su rotunda diferenciación.» Gabriela Mistral",Pablo Neruda,http://books.google.com/books/content?id=dqUjtAEACAAJ&printsec=frontcover&img=1&zoom=1&source=gbs_api,De Borsillo,2004,Literary Collections
72708,G Is for Grand Canyon : An Arizona Alphabet (Alphabet Series),"Yes, the magnificent Grand Canyon sprawls across northwestern Arizona. Many of us have been there and many of us will visit it soon, but how much do we know about the rest of this southwestern state? Author Barbara Gowan and illustrator Katherine Larson help elementary-aged students and older readers alike discover the wonders of the Grand Canyon State through rich images, informative expository text, and simple rhymes. G is for Grand Canyon's multi-tiered approach to educating and entertaining assures that this fall thousands of readers will travel through pages from A to Z, in and around and beyond the Grand Canyon.",Barbara Gowan,http://books.google.com/books/content?id=TtS7BgAAQBAJ&printsec=frontcover&img=1&zoom=1&edge=curl&source=gbs_api,Sleeping Bear Press,2010-10-08,Juvenile Nonfiction
65312,Topology of Surfaces,""" . . . that famous pedagogical method whereby one begins with the general and proceeds to the particular only after the student is too confused to understand even that anymore. "" Michael Spivak This text was written as an antidote to topology courses such as Spivak It is meant to provide the student with an experience in geomet describes. ric topology. Traditionally, the only topology an undergraduate might see is point-set topology at a fairly abstract level. The next course the average stu dent would take would be a graduate course in algebraic topology, and such courses are commonly very homological in nature, providing quick access to current research, but not developing any intuition or geometric sense. I have tried in this text to provide the undergraduate with a pragmatic introduction to the field, including a sampling from point-set, geometric, and algebraic topology, and trying not to include anything that the student cannot immediately experience. The exercises are to be considered as an in tegral part of the text and, ideally, should be addressed when they are met, rather than at the end of a block of material. Many of them are quite easy and are intended to give the student practice working with the definitions and digesting the current topic before proceeding. The appendix provides a brief survey of the group theory needed.",L.Christine Kinsey,http://books.google.com/books/content?id=-5DaBwAAQBAJ&printsec=frontcover&img=1&zoom=1&edge=curl&source=gbs_api,Springer Science & Business Media,2012-12-06,Mathematics
155490,Purgatorio (Bantam Classics),"An informative introduction and commentary accompany this classic translation of Dante's epic poem about a spiritual pilgrim being led by Virgil through the nine circles of hell, available in a dual-language edition. Reissue.",Dante Alighieri,http://books.google.com/books/content?id=g_dvDwAAQBAJ&printsec=frontcover&img=1&zoom=1&edge=curl&source=gbs_api,Bantam Classics,1982,Fiction
119360,Looking for a Better World: What Every Person Can Do!,This book is a dynamic way for individuals to improve their lives through understanding the impact of their own Right Actions in a troubled world.,"Stuart J. Malkin, Ph.D.",http://books.google.com/books/content?id=er-DvScVY9MC&printsec=frontcover&img=1&zoom=1&edge=curl&source=gbs_api,Infinity Publishing,2004-07,Self-Help
