id,title,description,authors,image,publisher,published_at,categories
103082,Kai's Journey to Gold Mountain,"In 1934, twelve-year-old Kai leaves China to join his father in America, but first he must take a long sea voyage, then endure weeks of crowded conditions and harsh examinations on Angel Island, fearing that he or his new friend will be sent home.",Katrina Saltonstall Currier,http://books.google.com/books/content?id=eQgjOQAACAAJ&printsec=frontcover&img=1&zoom=1&source=gbs_api,East West Discovery Press,2005,Juvenile Fiction
51787,Worship,"“A worship that will have staying power is a worship that is firmly grounded in the old, yet aware of and concerned for new ways to respond to the old, old story.”In the first edition of Worship Old and New, Robert E. Webber introduced an approach to worship that blended historical and traditional practices with contemporary elements. Since then, the spreading fires of worship renewal have provided opportunity for fresh consideration. This significantly revised edition is the result of Webber’s interaction with current worship trends. It is intended to be used both in the classroom and by those who want to improve worship in the local church.Reformatted for an easier, logical approach to worship theology, this revised edition of Worship Old and New is divided into four major sections, addressing the biblical foundation of worship, its theology, its history, and its practice. New information has been incorporated into each section to give the reader a better grasp of the biblical themes of worship, a deeper understanding of Old Testament customs, and a solid grounding in modern-day renewal movements.Especially significant is a reexamination of the actual practice of worship that goes beyond the merely academic to provide a practical perspective through the eyes of the worship leader and worshipers.Well-versed in the best of both past and present, Worship Old and New is a scholarly, up-to-date, and thought-provoking resource for those serious about exploring worship.",Robert E. Webber,http://books.google.com/books/content?id=qWrKQWmnWEAC&printsec=frontcover&img=1&zoom=1&edge=curl&source=gbs_api,Zondervan,2009-12-15,Religion
7237,"George Tice: Selected Photographs, 1953-1999 (Pocket Paragon)","The enduring work of photographer George Tice is represented here in 80 black-and-white images, beautifully presented in a small format book.",George A. Tice,http://books.google.com/books/content?id=afdTAAAAMAAJ&printsec=frontcover&img=1&zoom=1&source=gbs_api,David R. Godine Publisher,2001,Photography
149609,EZ- PLAY TODAY Frank Sinatra Songbook,"(E-Z Play Today). A fitting salute of 100 of Ol' Blue Eyes' best, including: The Best Is Yet to Come * Fly Me to the Moon (In Other Words) * For Once in My Life * Here's That Rainy Day * High Hopes * I've Got the World on a String * It Was a Very Good Year * The Lady Is a Tramp * Love and Marriage * My Way * Theme from ""New York, New York"" * Night and Day * One for My Baby (And One More for the Road) * September Song * Time After Time * (Love Is) The Tender Trap * Witchcraft * Young at Heart * and more.",Frank (COP) Sinatra,http://books.google.com/books/content?id=tE3joQEACAAJ&printsec=frontcover&img=1&zoom=1&source=gbs_api,Hal Leonard Publishing Corporation,2014-12-01,Music
161949,Acknowledging What Is: Conversations With Bert Hellinger,Hellinger sheds light on his unique use of family constellations to reveal hidden often destructive family dynamics and to active healing resources. Hellinger also speaks freely and frankly about his observations of the forces at work in family systems and the controversy that surrounds some of those observations.,"Bert Hellinger', 'Gabriele Ten Hövel",http://books.google.com/books/content?id=QXBhSk0yQUwC&printsec=frontcover&img=1&zoom=1&edge=curl&source=gbs_api,Zeig Tucker & Theisen Publishers,1999,Psychology
57999,All About Passion,"New York Times bestselling Australian author Stephanie Laurens delivers the latest tale in the immensely popular Cynster series. When Chillingworth is elected an 'honorary Cynster' at the end of All About Love, he knows he needs a wife, and an heir. His goal; a simple marriage without romance. He agrees to marry a woman he believes to be pliant and quiet. Unfortunately for him, the woman he thinks is Francesca Rawling is really her cousin, Franni. Francesca herself is proud, passionate and opinionated in short, the perfect bride for a Cynster...",Stephanie Laurens,http://books.google.com/books/content?id=6-5eOW3ko1YC&printsec=frontcover&img=1&zoom=1&edge=curl&source=gbs_api,Harper Collins,2009-03-17,Fiction
104838,The new care and training of the trotter and pacer,"Originally only available through the U.S. Trotting Association, they have now appointed us to distribute this well-respected harness horseman's bible. Known around the world as the ultimate reference on Standardbred care and training, The New Care and Training of the Trotter and Pacer has proven to be as invaluable as it is popular.Subjects covered in detail include: -- Veterinary Issues -- Shoeing and Hoof Care -- Conditioning and Training -- Yearling Selection -- Racing Strategy -- Stable Management -- Nutrition -- Breeding & Bloodlines -- Equipment -- Breaking the YearlingEach chapter has something for everyone, including owners, trainers, race drivers, pleasure drivers, stable managers, grooms, or even just your basic horse-lover who wants to learn more about the Standardbred. Learn the ropes from such well-known greats as John Campbell, Robert McIntosh, Gene Riegle, Tommy Houghton and many others.The New Care and Training of the Trotter and Pacer is a complement to every library and an asset to anyone involved with horses.",Curt Greene,http://books.google.com/books/content?id=MCtuwgEACAAJ&printsec=frontcover&img=1&zoom=1&source=gbs_api,United States Trotting Association,1996,Reference
200348,The Psychology of Birth Planning,"An eye-opening book that reveals crucial information every woman taking hormonal birth control should know This groundbreaking book sheds light on how hormonal birth control affects women--and the world around them--in ways we are just now beginning to understand. By allowing women to control their fertility, the birth control pill has revolutionized women's lives. Women are going to college, graduating, and entering the workforce in greater numbers than ever before, and there's good reason to believe that the birth control pill has a lot to do with this. But there's a lot more to the pill than meets the eye. Although women go on the pill for a small handful of targeted effects (pregnancy prevention and clearer skin, yay!), sex hormones can't work that way. Sex hormones impact the activities of billions of cells in the body at once, many of which are in the brain. There, they play a role in influencing attraction, sexual motivation, stress, hunger, eating patterns, emotion regulation, friendships, aggression, mood, learning, and more. This means that being on the birth control pill makes women a different version of themselves than when they are off of it. And this is a big deal. For instance, women on the pill have a dampened cortisol spike in response to stress. While this might sound great (no stress!), it can have negative implications for learning, memory, and mood. Additionally, because the pill influences who women are attracted to, being on the pill may inadvertently influence who women choose as partners, which can have important implications for their relationships once they go off it. Sometimes these changes are for the better . . . but other times, they're for the worse. By changing what women's brains do, the pill also has the ability to have cascading effects on everything and everyone that a woman encounters. This means that the reach of the pill extends far beyond women's own bodies, having a major impact on society and the world. This paradigm-shattering book provides an even-handed, science-based understanding of who women are, both on and off the pill. It will change the way that women think about their hormones and how they view themselves. It also serves as a rallying cry for women to demand more information from science about how their bodies and brains work and to advocate for better research. This book will help women make more informed decisions about their health, whether they're on the pill or off of it.",Sarah Hill,http://books.google.com/books/content?id=7BmtDwAAQBAJ&printsec=frontcover&img=1&zoom=1&edge=curl&source=gbs_api,Penguin,2019-10-01,Health & Fitness
193907,TOEFL iBT: The Official ETS Study Guide (McGraw-Hill's TOEFL iBT),"The official guide from the makers of the TOEFL to ensure your exam success! The Official Guide to the TOEFL® iBT is the leading guide to the most widely accepted English-language proficiency test in the world--the TOEFL test. Written by ETS, the makers of the test, this book includes two real full-length TOEFL tests for practice, as well as explanations of every section of the test and information on what is expected of you for every speaking and writing task. You will learn how to construct your answers and integrate the four skills needed to demonstrate academic English-language proficiency: reading, listening, speaking and writing. The accompanying CD-ROM provides on-screen interactive versions of both real TOEFL tests in the book, just like the one you will encounter on test day.",Educational Testing Service,http://books.google.com/books/content?id=5Tq_ugEACAAJ&printsec=frontcover&img=1&zoom=1&source=gbs_api,Mcgraw-hill,2009-06-16,Study Aids
150015,"The Conqueror's Child (Holdfast Chronicles, Bk IV)","Alldera's rape-conceived daughter Sorrell grows up among the Riding Women until her bond with a fellow misfit leads her to a reunion with her mother, who is building a new society in the former men-cities, and her mother's rapists.",Suzy McKee Charnas,http://books.google.com/books/content?id=I9q41XAdRWoC&printsec=frontcover&img=1&zoom=1&edge=curl&source=gbs_api,Macmillan,2000-08-05,Fiction
71904,The Republic (Non Fiction),"A New York Times bestseller The author of the beloved #1 New York Times bestseller Reading Lolita in Tehran returns with the next chapter of her life in books—a passionate and deeply moving hymn to America Ten years ago, Azar Nafisi electrified readers with her multimillion-copy bestseller Reading Lolita in Tehran, which told the story of how, against the backdrop of morality squads and executions, she taught The Great Gatsby and other classics of English and American literature to her eager students in Iran. In this electrifying follow-up, she argues that fiction is just as threatened—and just as invaluable—in America today. Blending memoir and polemic with close readings of her favorite novels, she describes the unexpected journey that led her to become an American citizen after first dreaming of America as a young girl in Tehran and coming to know the country through its fiction. She urges us to rediscover the America of The Wonderful Wizard of Oz and Adventures of Huckleberry Finn and challenges us to be truer to the words and spirit of the Founding Fathers, who understood that their democratic experiment would never thrive or survive unless they could foster a democratic imagination. Nafisi invites committed readers everywhere to join her as citizens of what she calls the Republic of Imagination, a country with no borders and few restrictions, where the only passport to entry is a free mind and a willingness to dream.",Azar Nafisi,http://books.google.com/books/content?id=8jNBAwAAQBAJ&printsec=frontcover&img=1&zoom=1&edge=curl&source=gbs_api,Penguin,2014-10-21,Biography & Autobiography
26396,Hot for Him (Harlequin Blaze),"Forbidden Fantasy #2 Being desired by more than one man... Ph. D. student Zoe McNamara can figure anything out — except her mind-numbing attraction to Jed Calhoun. The sexy, secretive man is all she can think about. So she decides to sleep with the big, blond enigma — just once — and get him out of her system for good.",Cara Summers,http://books.google.com/books/content?id=Y0EZI1PwFGwC&printsec=frontcover&img=1&zoom=1&source=gbs_api,HarperCollins UK,2010-12-01,Fiction
18201,Aztec,"The epic tale of an Aztec survivor of the Spanish conquest and his times as a warrior, scribe, travelling merchant, confidant of Motecuhzoma II, and envoy to the invading Spaniards",Gary Jennings,http://books.google.com/books/content?id=GPhvAAAAMAAJ&printsec=frontcover&img=1&zoom=1&source=gbs_api,Atheneum Books,1980,Fiction
103317,The Sovereignty of God,"When was the last time we truly paused to meditate and study the crucially important doctrine of the sovereignty of God? In this book A.W. Pink unpacks the theology of the sovereignty of God for us in a way few others have before or after him. Pink dives into Scripture not only to define the sovereignty of God; he goes on to help us apply the doctrine to various aspects of our lives. Pink passionately challenges us to wrestle with and accept a higher, deeper and broader view of our omniscient and omnipotent King.",A.W. Pink,http://books.google.com/books/content?id=3-60DQAAQBAJ&printsec=frontcover&img=1&zoom=1&edge=curl&source=gbs_api,Gideon House Books,2016-11-13,Religion
111760,Full Bloom (Full Series),"This winter promises record-high temperatures-and A DESIRE that reaches the boiling point... Beaumont, South Carolina, is on ""sizzle"" this February. So is its newest entrepreneur, Annie Fortenberry, who has inherited her grandmother's B&B. According to a local psychic she also inherited a spirit from its glory days as a brothel-not the kind of publicity the Peachtree Bed & Breakfast needs if it's hosting millionaire Max Holt's upcoming wedding! If rumors of a prank-playing ghost aren't stressful enough, a mysterious man has arrived with an eye on Annie and her master suite. Wes Bridges is all leather and denim, sporting a two-day beard, straddling a Harley, and sending the B&B's testosterone level through the roof. Annie's cool demeanor may be dropping as fast as Wes's jeans, but leave it to her missing ex-husband to dampen the passion! Turns out someone has done him in, and all evidence points to Annie...Wrapped up in a murder plot, Annie must find the killer, save her own neck, and get back to where she was-wrapped up in Wes's strong-loving arms... Fast-paced action, steamy sex, suspense, and lots of laughs-it's the Full series from #1 bestselling author, Janet Evanovich and Charlotte Hughes ""Will greatly please readers with its rapid-fire dialogue, roller-coaster pace, and unconventional characters.""-Booklist (starred review) on Full Bloom","Janet Evanovich', 'Charlotte Hughes",http://books.google.com/books/content?id=W78CbJDi7UYC&printsec=frontcover&img=1&zoom=1&edge=curl&source=gbs_api,St. Martin's Paperbacks,2005-04-05,Fiction
118658,Hollywood Hoofbeats: Trails Blazed Across The Silver Screen,"In Hollywood Hoofbeats, author Petrine Day Mitchum tells stories in page-turning detail, covering topics such as behind-the-scenes portraits of both famous movie horses and those virtually unknown; personal accounts from their trainers, owners, and costars; simple and complex horse stunts, from a fall in mid-gallop to a race across a bridge during a live explosion; and historic black-and-white photos and richly colored contemporary stills.","Petrine Day Mitchum', 'Audrey Pavia",http://books.google.com/books/content?id=MhgiAAAACAAJ&printsec=frontcover&img=1&zoom=1&source=gbs_api,I5 Press,2005,Nature
183336,Nuestra senora de la soledad (Spanish Edition),"The story of the missions is a compelling human drama that is a vital piece not only of California history, but also of American history. Indeed, many keys to California's past lie in the stories of the 20 missions that stretch along the state's west coast from San Diego to San Francisco. This vital series is compatible with the mission-baed curriculum used in fourth-grade California classrooms. It resonates equally with all social studies programs that explore the defunct notion of colonialism and its controversial role in the history of the United States, and with curricula that seek to explore the interaction of different cultures and the rights and voices of indigenous peoples.",Kim Ostrow,http://books.google.com/books/content?id=Mbvqpyha9dYC&printsec=frontcover&img=1&zoom=1&edge=curl&source=gbs_api,"The Rosen Publishing Group, Inc",2003-12-15,Juvenile Nonfiction
90459,"A Wealth of Family: An Adopted Son's International Quest for Heritage, Reunion, and Enrichment (Family Success)","This inspiring adoption and reunion saga delivers provocative viewpoints on multicultural families and powerful insights on overcoming racism and poverty. Brooks was the only child of a struggling African-American single mother in inner-city Pittsburgh. Then he learned at age eleven that he was adopted. He did not know it at the time, but Brooks had actually been born to a white biological mother who descended from Lithuanian Jews and a black Kenyan foreign student father.",Thomas Brooks,http://books.google.com/books/content?id=RT_vE7AUAvcC&printsec=frontcover&img=1&zoom=1&edge=curl&source=gbs_api,"Alpha Multimedia, Inc.",2006,Family & Relationships
120654,"Vs Teenage Mutant Ninja Turtles (The Savage Dragon, No. 2)","Anxious to have an exclusive licensing deal, Barbaric proposes to Ricochet, assuming that there would be public outcry if action figures were produced of unwed and underage parents.",Erik Larsen,http://books.google.com/books/content?id=1cv_CgAAQBAJ&printsec=frontcover&img=1&zoom=1&edge=curl&source=gbs_api,Image Comics,1997-08-31,Comics & Graphic Novels
152348,"Sacred Verses, Healing Sounds, Volumes I and II: The Bhagavad Gita, Hymns of the Rig Veda (Chopra, Deepak)","Unshackle your mind and claim your spiritual birthright of freedom, wholeness, and joy through the perennial wisdom of ancient yoga There’s a reason that the Vedas, a 5,000-year-old collection of celebrated verses from ancient India, have given rise to several world religions and influenced Western thinkers from Emerson to Ram Dass—they provide us with a uniquely accessible and effective path to liberation and sovereignty. With Sovereign Self, Acharya Shunya shares a groundbreaking guide to the wisdom of these classic texts so that each of us may emancipate ourselves from restrictive belief systems and discover our true nature—that which is always whole, joyful, and free. As the first female lineage holder in a 2,000-year-old line of spiritual teachers, Shunya provides a rare opportunity to receive these authentic teachings from a genuine Vedic master—one with a distinctly down-to-earth, feminine flavor who never lets us forget that our humanity is to be embodied and enjoyed. Throughout Sovereign Self, Shunya adeptly guides us through the core concepts and practices of the Vedas, demystifying and contextualizing sacred concepts for modern life. In this masterful guide, you’ll explore: Beginning the journey to radical self-acceptance—recognize your innate worth and wholeness How we create our own prisons of shame, compulsion, blame, and obsession—and how you can begin to break free Learning to embody personal autonomy in your life and relationships Clear advice from a Vedic master for avoiding countless obstacles on the path to liberation—from spiritual bypassing to the true meaning of guru Original meditations and contemplative practices taken directly from Shunya’s 2000-year-old lineage How to wake up from being a “sleepwalker” and find authentic freedom, everlasting joy, and unshakable sovereignty Filled with hidden insights and engaging guidance, Sovereign Self will help you awaken and recognize your potential to be joyful, resourceful, abundant, limitlessly expansive, and sovereign.",Acharya Shunya,http://books.google.com/books/content?id=LdToDwAAQBAJ&printsec=frontcover&img=1&zoom=1&edge=curl&source=gbs_api,Sounds True,2020-12-29,Religion
181191,Restoring At-Risk Communities: Doing It Together and Doing It Right,This comprehensive handbook to urban ministry introduces and shows how to implement a Christian community development program.,John M. Perkins,http://books.google.com/books/content?id=1-_zCgX9m5QC&printsec=frontcover&img=1&zoom=1&edge=curl&source=gbs_api,Baker Books,1996-02-01,Religion
155247,Ancient World (Illustrated World History),"Take a trip through the defining moments of our global story and see the thinkers, leaders, ideas, and inventions that have shaped the world. Presented in a beautiful slipcase, World History is an essential guide for anyone who loves history or wants to broaden their knowledge. This accessible book covers over 350 of the world's most important turning points, from our earliest human ancestors of prehistory to political events of the modern world. Follow detailed maps showing the continuous movement of humans across the Earth, and examine fascinating paintings illustrating the events and individuals that took them there. Beautiful photography throughout the book will carry you back in time to see the people and places of the stories - along with stunning artifacts from every historical period. From magnificent buildings like the Colosseum to magnificent words like ""I have a dream!"", this guide brings history's most significant events to life for every reader to discover and enjoy.",Philip Parker,http://books.google.com/books/content?id=ObbjDwAAQBAJ&printsec=frontcover&img=1&zoom=1&edge=curl&source=gbs_api,Penguin,2017-10-03,History
136698,"Physics, Second Edition","This text provides an introduction to the important physics underpinning current technologies, highlighting key concepts in areas that include linear and rotational motion, energy, work, power, heat, temperature, fluids, waves, and magnetism. This revision reflects the latest technology advances, from smart phones to the Internet of Things, and all kinds of sensors. The author also provides more modern worked examples with useful appendices and laboratories for hands-on practice. There are also two brand new chapters covering sensors as well as electric fields and electromagnetic radiation as applied to current technologies.",Daniel H. Nichols,http://books.google.com/books/content?id=EYF_DwAAQBAJ&printsec=frontcover&img=1&zoom=1&edge=curl&source=gbs_api,CRC Press,2018-12-07,Science
169597,The Devil's Hawk,"Visiting a friend's home in Arizona to learn the truth about the death of the man's sister, ornithologist Jonathan Wilder teams up with widowed border patrol agent Max Montoya to investigate local smuggling operations.",Ray Sipherd,http://books.google.com/books/content?id=8FLDTOlooE8C&printsec=frontcover&img=1&zoom=1&edge=curl&source=gbs_api,Macmillan,2002-08-03,Fiction
106767,Caught in the Crossfire : The Crenshaws of Texas (Desire),"Busted! And in only boxer briefs in the bed of a senator's daughter! Despite no memory of their night together, Jared Crenshaw knew that nothing had happened. Heck, Lindsey Russell was still wearing a neck-to-toe nightgown. And Jared knew that had he tasted this woman's passion, not even amnesia could make him forget. Still, there was the appearance of a Texas-size scandal…. So, Jared married Lindsey to do right by her. And their first time in the marriage bed confirmed what Jared suspected: he'd never been with this woman because she'd never been with any man. Clearly, he'd been set up, albeit sweetly so. Now, it was simply a matter of figuring out who…and why.",Annette Broadrick,http://books.google.com/books/content?id=pXlImvmHMJ8C&printsec=frontcover&img=1&zoom=1&edge=curl&source=gbs_api,Silhouette,2010-10-01,Fiction
153013,Creating Health,"Dr. Chopra has revised his groundbreaking book about the healing power of the mind for the people who are turning to alternative methods of health care as a result of the crisis in traditional care. Based on Dr. Chopra's recent work and new perspectives, this book includes the techniques of mindfulness meditation, a simple but powerful form of breath-focused meditation.",Deepak Chopra,http://books.google.com/books/content?id=PNXWmSfdIlMC&printsec=frontcover&img=1&zoom=1&edge=curl&source=gbs_api,Houghton Mifflin Harcourt,1995-09,Health & Fitness
36606,Girl Net: A Girls' Guide to the Internet and More!,Presents a collection of essays that focus on teenage girls' Internet use.,"Sharon R. Mazzarella', 'Sharon R.. Mazzarella', 'Cameron McCarthy', 'Angharad N Valdivia",http://books.google.com/books/content?id=M_aTqHdkt4UC&printsec=frontcover&img=1&zoom=1&edge=curl&source=gbs_api,Peter Lang,2005,Computers
149982,Nancy and Plum,"Two orphaned sisters are sent to live at a boarding home run by the cruel and greedy Mrs. Monday, where they dream about someday having enough to eat and being able to experience a real Christmas.",Betty Bard MacDonald,http://books.google.com/books/content?id=Fp43E0_Nk1wC&printsec=frontcover&img=1&zoom=1&edge=curl&source=gbs_api,Yearling Books,2011,Juvenile Fiction
138876,Teach Yourself Romanian (Teach Yourself Tape),"The Danube is Europe's Amazon. It flows through more countries than any other river on Earth - from the Black Forest in Germany to Europe's farthest fringes, where it joins the Black Sea in Romania. Andrew Eames' journey along its length brings us face to face with the Continent's bloodiest history and its most pressing issues of race and identity. As he travels - by bicycle, horse, boat and on foot - Eames finds himself seeking a bed for the night with minor royalty, hitching a ride on a Serbian barge captained by a man called Attila and getting up close and personal with a bull in rural Romania. He meets would-be kings and walks with gypsies, and finally rows his way beyond the borders of Europe entirely...",Andrew Eames,http://books.google.com/books/content?id=iUqKafcKRukC&printsec=frontcover&img=1&zoom=1&edge=curl&source=gbs_api,Random House,2011-02-08,Travel
